"https://www.tops-int.com/webinar/certificate","text/html; charset=UTF-8","200","OK","Indexable","","Join TOPS Webinars & Earn a Certificate of Participation","56","496","Participate in TOPS Technologies webinars and earn a Certificate of Participation. Gain expert knowledge, improve your skills, and advance your career with us!","159","981","","0","","0","Webinar Certificate of Participation","36","Key Highlights","14","","","","https://www.tops-int.com/webinar/certificate","","","","","","220327","21765","21765","8.476","","1015","317","3.202","73.393","Fairly Easy","6.020","1","1","","377","187","0","99.470","280","131","0","26","20","0","","","","","a5cbb6d2b8fb9eca49a0507f12caf74c","0.699","","","","","en","1.1","","https://www.tops-int.com/webinar/certificate","2025-05-26 13:16:25"
"https://www.tops-int.com/data-visualization-course","text/html; charset=UTF-8","200","OK","Indexable","","Data Visualization course : Data Visualization Training - TOPS","62","541","⭐TOPS offers the ✅ Data Visualization Course with 100%  Job Placement Assistance, Get hands-on training from industry experts & Live Project Training with Govt Certificate.","172","1064","Data Visualization Training, Data Visualization course, Data Visualization Certification","88","Data Visualization Course","25","Our Facts and Figures","21","Key Highlights","14","","","","https://www.tops-int.com/data-visualization-course","","","","","","239398","24191","24191","9.421","","995","304","3.273","71.469","Fairly Easy","5.414","1","0","","405","187","0","99.470","276","123","0","27","21","0","","","","","a10e7097e6d3dc5984d38dc19bc01a21","0.694","","","","","en","1.1","","https://www.tops-int.com/data-visualization-course","2025-05-26 13:16:25"
"https://www.tops-int.com/hibernate-training-course","text/html; charset=UTF-8","200","OK","Indexable","","Hibernate Training Course With Job Placement - TOPS","51","481","Looking for the ✅ Hibernate training course & classes? Learn Hibernate with our certified java trainers & work with live projects to get certification & 100% Job!","162","973","Hibernate Course, Hibernate training, Learn Hibernate","53","Hibernate Training Course With Job Placement","44","Our Facts and Figures","21","Key Highlights","14","","","","https://www.tops-int.com/hibernate-training-course","","","","","","231555","23442","23442","9.129","","818","272","3.007","70.781","Fairly Easy","5.194","1","0","","404","187","0","99.470","275","123","0","25","19","0","","","","","22e6e70d69b6962625b6eabc3b95d3e1","0.808","","","","","en","1.1","","https://www.tops-int.com/hibernate-training-course","2025-05-26 13:16:25"
"https://www.tops-int.com/blog/benefits-and-importance-of-learning-php-language","text/html; charset=UTF-8","200","OK","Indexable","","What are the Benefits of Learning PHP Language?","47","441","With multiple languages around, is learning PHP a necessity? Find out why you should learn a crucial language such as PHP and take the PHP course today!","152","964","Learning PHP Language","21","Benefits and Importance of Learning PHP Language","48","What is PHP?","12","Stay Connected","14","","","","https://www.tops-int.com/blog/benefits-and-importance-of-learning-php-language","","","","","","182526","21494","21494","8.371","","1661","259","6.413","63.723","Normal","9.440","2","1","","8","5","0","2.660","315","185","0","11","7","0","","","","","790f24ed02ae033e0df24ac323a46444","0.253","","","","","en","1.1","","https://www.tops-int.com/blog/benefits-and-importance-of-learning-php-language","2025-05-26 13:16:26"
"https://www.tops-int.com/images/courses/tools-icon.svg","image/svg+xml","200","OK","Indexable","","","0","0","","0","0","","0","","0","","0","","0","","","","","","","","","","9909","9909","9909","3.859","","0","","","","","0.000","2","2","","0","0","0","0.000","0","0","0","0","0","0","","","","","","0.022","Fri, 10 Mar 2023 11:49:28 GMT","","","","","1.1","","https://www.tops-int.com/images/courses/tools-icon.svg","2025-05-26 13:16:26"
"https://www.tops-int.com/js/course.js?ver=2.06","application/javascript; charset=utf-8","200","OK","Indexable","","","0","0","","0","0","","0","","0","","0","","0","","","","","","","","","","0","0","0","0.000","","0","","","","","0.000","2","1","","0","0","0","0.000","0","0","0","0","0","0","","","","","","0.067","Fri, 10 Mar 2023 11:49:28 GMT","","","","","1.1","","https://www.tops-int.com/js/course.js?ver=2.06","2025-05-26 13:16:26"
"https://www.tops-int.com/blog/a-complete-guide-on-how-to-start-a-successful-php-career","text/html; charset=UTF-8","200","OK","Indexable","","A Complete Guide on How to Start a Successful PHP Career - TOPS Technologies","76","718","","0","0","PHP Developer, PHP Certification courses, PHP Certifications courses, PHP Developer courses, PHP development course, PHP Training, PHP Training institutes, PHP tutorial full course","180","A Complete Guide on How to Start a Successful PHP Career","56","Introduction","12","Typical applications of PHP","27","","","","https://www.tops-int.com/blog/a-complete-guide-on-how-to-start-a-successful-php-career","","","","","","200566","28040","28040","10.920","","4748","609","7.796","63.059","Normal","17.946","2","1","","6","4","0","2.130","308","181","0","11","7","0","","","","","dc9e9f7b08e6acd0f6bcb3f06e404d30","0.266","","","","","en","1.1","","https://www.tops-int.com/blog/a-complete-guide-on-how-to-start-a-successful-php-career","2025-05-26 13:16:26"
"https://www.tops-int.com/blog/a-guide-to-career-in-php","text/html; charset=UTF-8","200","OK","Indexable","","How to Grow Your Career After Learning PHP?","43","408","Have you enrolled in a PHP online course but are wondering how it will benefit your career? Here is a guide on how to grow your career with PHP training.","153","945","Learning PHP","12","A Guide to Career in PHP","24","What is PHP?","12","What Career Opportunities Does PHP Offer?","41","","","","https://www.tops-int.com/blog/a-guide-to-career-in-php","","","","","","181311","20896","20896","8.138","","1382","212","6.519","64.809","Normal","8.534","2","1","","8","5","0","2.660","314","185","0","10","6","0","","","","","9b51d8dd47c522c9ac5cdfa1f48e9f24","0.308","","","","","en","1.1","","https://www.tops-int.com/blog/a-guide-to-career-in-php","2025-05-26 13:16:27"
"https://www.tops-int.com/blog/php-training-course-to-avoid-these-7-common-mistakes","text/html; charset=UTF-8","200","OK","Indexable","","Enroll in a PHP Training Course to Skip these Common Mistakes","61","566","Planning to enrol in a PHP developer course? Learn how pursuing a PHP course from a dignified PHP training institute in Ahmedabad can better your chances of landing your dream job.","180","1140","PHP Training Course","19","Join a PHP Training Course to Avoid These 7 Common Mistakes!","60","Enroll in the Best PHP Training Institute in Ahmedabad","54","Stay Connected","14","","","","https://www.tops-int.com/blog/php-training-course-to-avoid-these-7-common-mistakes","","","","","","177301","19920","19920","7.758","","1070","176","6.080","64.118","Normal","7.632","2","1","","10","6","0","3.190","315","186","0","10","6","0","","","","","20dc97684f16f0d8f317506c984a07bd","0.386","","","","","en","1.1","","https://www.tops-int.com/blog/php-training-course-to-avoid-these-7-common-mistakes","2025-05-26 13:16:27"
"https://www.tops-int.com/images/companies/companies-banner.png","image/png","200","OK","Indexable","","","0","0","","0","0","","0","","0","","0","","0","","","","","","","","","","109957","109957","109957","42.822","","0","","","","","0.000","2","2","","0","0","0","0.000","0","0","0","0","0","0","","","","","","0.052","Fri, 10 Mar 2023 11:49:28 GMT","","","","","1.1","","https://www.tops-int.com/images/companies/companies-banner.png","2025-05-26 13:16:27"
"https://www.tops-int.com/css/companies-list.css","text/css","200","OK","Indexable","","","0","0","","0","0","","0","","0","","0","","0","","","","","","","","","","0","0","0","0.000","","0","","","","","0.000","2","1","","0","0","0","0.000","0","0","0","0","0","0","","","","","","0.024","Fri, 10 Mar 2023 11:49:28 GMT","","","","","1.1","","https://www.tops-int.com/css/companies-list.css","2025-05-26 13:16:29"
"https://www.tops-int.com/images/youtube.svg","image/svg+xml","200","OK","Indexable","","","0","0","","0","0","","0","","0","","0","","0","","","","","","","","","","1025","1025","1025","0.399","","0","","","","","0.000","2","1","","0","0","0","0.000","0","0","0","0","0","0","","","","","","0.070","Fri, 10 Mar 2023 11:49:28 GMT","","","","","1.1","","https://www.tops-int.com/images/youtube.svg","2025-05-26 13:16:35"
"https://www.tops-int.com/top-it-companies?page=4","text/html; charset=UTF-8","200","OK","Non-Indexable","Canonicalised","Top Computer Courses in India – Learn with TOPS Technologies","60","570","Join India’s leading institute for computer courses. Learn coding, design, data science & more. 100% job-focused training. Get certified today.","143","874","","0","Explore the Best Workplace","26","","0","","0","","","","https://www.tops-int.com/","","","","","","197517","20799","20799","8.100","","1207","254","4.752","51.176","Fairly Hard","7.706","2","0","","7","4","0","2.130","256","130","0","29","29","0","","","","","c505621ae3bf7c0f04e1d422e3b168d4","0.607","","","","","en","1.1","","https://www.tops-int.com/top-it-companies?page=4","2025-05-26 13:16:35"
"https://www.tops-int.com/top-it-companies?page=3","text/html; charset=UTF-8","200","OK","Non-Indexable","Canonicalised","Top Computer Courses in India – Learn with TOPS Technologies","60","570","Join India’s leading institute for computer courses. Learn coding, design, data science & more. 100% job-focused training. Get certified today.","143","874","","0","Explore the Best Workplace","26","","0","","0","","","","https://www.tops-int.com/","","","","","","199284","21191","21191","8.253","","1236","261","4.736","51.788","Fairly Hard","7.752","2","0","","8","4","0","2.130","255","129","0","34","34","0","","","","","e92a901e1e00621b94b8458f1986dc90","0.609","","","","","en","1.1","","https://www.tops-int.com/top-it-companies?page=3","2025-05-26 13:16:35"
"https://www.tops-int.com/top-it-companies?page=2","text/html; charset=UTF-8","200","OK","Non-Indexable","Canonicalised","Top Computer Courses in India – Learn with TOPS Technologies","60","570","Join India’s leading institute for computer courses. Learn coding, design, data science & more. 100% job-focused training. Get certified today.","143","874","","0","Explore the Best Workplace","26","","0","","0","","","","https://www.tops-int.com/","","","","","","199117","21775","21775","8.480","","1574","305","5.161","53.628","Fairly Hard","8.804","2","0","","8","4","0","2.130","254","128","0","27","27","0","","","","","a2ed448b01540658b51db303362ab635","0.677","","","","","en","1.1","","https://www.tops-int.com/top-it-companies?page=2","2025-05-26 13:16:35"
"https://www.tops-int.com/blog/technical-seo","text/html; charset=UTF-8","200","OK","Indexable","","Technical SEO Essentials: Optimizing Website Speed, Mobile-Friendliness, and Fixing Indexing Issues","99","890","Boost SEO success by optimizing speed, mobile-friendliness, and fixing indexing issues today!","93","581","SEO services, SEO, Backlinks,On-page SEO,SEO Marketing","54","Technical SEO Essentials: Optimizing Website Speed, Mobile-Friendliness, and Fixing Indexing Issues","99","Why Technical SEO Matters ?","27","Final Thoughts","14","","","","https://www.tops-int.com/blog/technical-seo","","","","","","178652","20044","20044","7.806","","1028","187","5.497","47.691","Hard","7.703","2","1","","16","12","0","6.380","313","184","0","10","6","0","","","","","10154dfc5a602c2513b52386eaeca4e0","0.298","","","","","en","1.1","","https://www.tops-int.com/blog/technical-seo","2025-05-26 13:16:36"
"https://www.tops-int.com/blog/blogging-for-seo","text/html; charset=UTF-8","200","OK","Indexable","","Blogging for SEO: Best Practices to Optimize Your Blog Content for Search Engines","81","732","Learn best practices to optimize your blog for SEO and boost rankings with effective content strategies.","104","640","SEO blogging, Content optimization, Blog SEO tips, Keyword research for blogging, On-page SEO techniques","104","Blogging for SEO: Best Practices to Optimize Your Blog Content for Search Engines","81","Why Blogging for SEO Matters","28","Building an Effective Content Strategy","38","","","","https://www.tops-int.com/blog/blogging-for-seo","","","","","","179777","20503","20503","7.985","","1156","211","5.479","56.956","Fairly Hard","8.027","2","1","","17","12","0","6.380","314","185","0","10","6","0","","","","","b24ed127b01c38453918439416f000e0","0.342","","","","","en","1.1","","https://www.tops-int.com/blog/blogging-for-seo","2025-05-26 13:16:37"
"https://www.tops-int.com/blog/backlinks-offpage-seo-how-they-boost-your-rankings-and-how-to-build-them","text/html; charset=UTF-8","200","OK","Indexable","","Backlinks & Off-Page SEO: How They Boost Your Rankings and How to Build Them","76","725","Learn how backlinks impact SEO rankings and discover effective strategies for acquiring them.","93","585","Off Page activities, SEO , Digital Marketing Course","51","Backlinks & Off-Page SEO: How They Boost Your Rankings and How to Build Them","76","What Are Backlinks and Why Are They Important?","46","How Backlinks Boost SEO Rankings ?","34","","","","https://www.tops-int.com/blog/backlinks-offpage-seo-how-they-boost-your-rankings-and-how-to-build-them","","","","","","179021","20351","20351","7.925","","1199","207","5.792","55.181","Fairly Hard","8.232","2","1","","17","12","0","6.380","313","184","0","10","6","0","","","","","580b9fd101a5bf112e38905472361a3b","0.325","","","","","en","1.1","","https://www.tops-int.com/blog/backlinks-offpage-seo-how-they-boost-your-rankings-and-how-to-build-them","2025-05-26 13:16:37"
"https://www.tops-int.com/blog/content-planning","text/html; charset=UTF-8","200","OK","Indexable","","Content Planning Made Simple: A Practical Guide to Building an Editorial Calendar and Choosing the Right Topics","111","998","Master content planning with a simple guide to building calendars and selecting winning topics.","95","594","Content Marketing, Editorial Calendar, Content Strategy, Digital Marketing, SEO","79","Content Planning Made Simple: A Practical Guide to Building an Editorial Calendar and Choosing the Right Topics","111","Why Content Planning Matters","28","Upskill Your Content Strategy with TOPS Technologies","52","","","","https://www.tops-int.com/blog/content-planning","","","","","","179818","20513","20513","7.989","","1223","218","5.610","55.875","Fairly Hard","8.272","2","1","","20","12","0","6.380","313","184","0","10","6","0","","","","","6a8bff51826d7028e6aef00659c63d9e","0.335","","","","","en","1.1","","https://www.tops-int.com/blog/content-planning","2025-05-26 13:16:38"
"https://www.tops-int.com/live-project-training-ios","text/html; charset=UTF-8","200","OK","Indexable","","iOS Live Project Training & Get Certified With  Job Placement","61","533","Get iOS Live Project Training Course, iOS real-time sample projects with ✅ Project Definitions, a Govt Certificate & 100% Job on Project Completion. Enroll now!","160","975","Live Project Training in iOS","28","iOS Live Project Training Course","32","Our Facts and Figures","21","Key Highlights","14","","","","https://www.tops-int.com/live-project-training-ios","","","","","","248053","25354","25354","9.874","","1439","385","3.738","67.999","Normal","6.401","2","0","","17","9","0","4.790","278","124","0","32","26","0","","","","","9b95cfb7d873fcc6d19a94348c905f2","0.650","","","","","en","1.1","","https://www.tops-int.com/live-project-training-ios","2025-05-26 13:16:39"
"https://www.tops-int.com/blog/is-software-testing-a-good-career","text/html; charset=UTF-8","200","OK","Indexable","","Is Software Testing A Good Career?","34","314","Exploring the potential and growth opportunities in a software testing career. Dive deeper with our comprehensive software testing course to determine if it's the right fit for you.","181","1092","Software Testing Course in Ahmedabad, software testing company in ahmedabad, software testing training in ahmedabad, software testing classes in ahmedabad, best software testing training institute in ahmedabad","209","Is Software Testing A Good Career?","34","Stay Connected","14","","0","","","","https://www.tops-int.com/blog/is-software-testing-a-good-career","","","","","","193147","24076","24076","9.376","","1999","320","6.247","60.919","Normal","10.186","2","1","","11","6","0","3.190","320","189","0","10","6","0","","","","","ad6e02a4653a214f5161b2b05cd8a042","0.495","","","","","en","1.1","","https://www.tops-int.com/blog/is-software-testing-a-good-career","2025-05-26 13:16:39"
"https://www.tops-int.com/machine-learning-course-in-vadodara","text/html; charset=UTF-8","200","OK","Indexable","","Machine Learning Course in Vadodara - TOPS Technologies","55","527","Machine Learning Training Course in Vadodara by Fully Experienced Developers work on Live Projects - Attend Free Demo - 100% Job and Govt Certification - ⭐TOPS Technologies","172","1102","Machine Learning Course in Vadodara","35","Machine Learning Course in Vadodara","35","Our Facts and Figures","21","Key Highlights","14","","","","https://www.tops-int.com/machine-learning-course-in-vadodara","","","","","","256594","30081","30081","11.715","","3787","670","5.652","54.818","Fairly Hard","12.438","2","0","","16","7","0","3.720","278","129","0","25","19","0","","","","","d11175ebaae88ed0e7492a6ef407af51","0.581","","","","","en","1.1","","https://www.tops-int.com/machine-learning-course-in-vadodara","2025-05-26 13:16:39"
"https://www.tops-int.com/blog/7-easy-steps-to-attain-your-istqb-certification","text/html; charset=UTF-8","200","OK","Indexable","","7 Easy Steps to Attain Your ISTQB Certification -  TOPS","55","479","Discover the 7 easy steps to attain your ISTQB certification effortlessly. Join our best software testing course for expert guidance and success","144","881","istqb certificate, istqb foundation, istqb certification cost, istqb exam, istqb certified tester foundation level, istqb foundation level certification,istqb certified tester","175","7 Easy Steps to Attain Your ISTQB Certification","47","1: Understand the Importance of ISTQB Certification","51","2: Familiarize Yourself with ISTQB Certification Levels","55","","","","https://www.tops-int.com/blog/7-easy-steps-to-attain-your-istqb-certification","","","","","","176975","19458","19458","7.578","","920","158","5.823","51.587","Fairly Hard","7.405","2","1","","8","5","0","2.660","314","183","0","10","6","0","","","","","ac1876756e6a4f7c596ed86296690d44","0.294","","","","","en","1.1","","https://www.tops-int.com/blog/7-easy-steps-to-attain-your-istqb-certification","2025-05-26 13:16:40"
"https://www.tops-int.com/js/placement_media.js","application/javascript; charset=utf-8","200","OK","Indexable","","","0","0","","0","0","","0","","0","","0","","0","","","","","","","","","","0","0","0","0.000","","0","","","","","0.000","2","1","","0","0","0","0.000","0","0","0","0","0","0","","","","","","0.029","Fri, 10 Mar 2023 11:49:28 GMT","","","","","1.1","","https://www.tops-int.com/js/placement_media.js","2025-05-26 13:16:40"
"https://www.tops-int.com/images//placements/jobfest-2024.png","image/png","200","OK","Indexable","","","0","0","","0","0","","0","","0","","0","","0","","","","","","","","","","461193","461193","461193","179.607","","0","","","","","0.000","2","2","","0","0","0","0.000","0","0","0","0","0","0","","","","","","0.042","Tue, 19 Nov 2024 06:46:08 GMT","","","","","1.1","","https://www.tops-int.com/images//placements/jobfest-2024.png","2025-05-26 13:16:40"
"https://www.tops-int.com/blog/2025-career-goals-for-software-testers","text/html; charset=UTF-8","200","OK","Indexable","","2025 Career Goals for Software Testers - TOPS Technologies","58","539","Achieve your 2025 career goals with a Software Testing Course. Enhance skills, gain certifications, and stay updated with industry trends. Transform your software testing career today!","184","1139","Software Testing Course in Ahmedabad, software testing company in ahmedabad, software testing training in ahmedabad, software testing classes in ahmedabad, best software testing training institute in ahmedabad","209","2025 Career Goals for Software Testers","38","Understanding the Role of a Software Tester in 2025","51","Enhancing Technical Proficiency","31","","","","https://www.tops-int.com/blog/2025-career-goals-for-software-testers","","","","","","185097","21986","21986","8.562","","1767","317","5.574","43.995","Hard","10.408","2","1","","8","5","0","2.660","316","183","0","10","6","0","","","","","fecac5864556d880b9d13ec958bbb7cb","0.316","","","","","en","1.1","","https://www.tops-int.com/blog/2025-career-goals-for-software-testers","2025-05-26 13:16:40"
"https://www.tops-int.com/css/placement_event.css","text/css","200","OK","Indexable","","","0","0","","0","0","","0","","0","","0","","0","","","","","","","","","","0","0","0","0.000","","0","","","","","0.000","2","1","","0","0","0","0.000","0","0","0","0","0","0","","","","","","0.023","Fri, 10 Mar 2023 11:49:28 GMT","","","","","1.1","","https://www.tops-int.com/css/placement_event.css","2025-05-26 13:16:40"
"https://www.tops-int.com/selenium-training-in-vadodara","text/html; charset=UTF-8","200","OK","Indexable","","Selenium Training in Vadodara - TOPS Technologies","49","461","Learn Selenium Training in Vadodara? ⭐TOPS Technologies Provide best Selenium Testing course with live project and 100% Job Placement Assistance with Govt Certificate","166","1067","Selenium Training in Vadodara, selenium offline coaching in vadodara, selenium institute in vadodara, selenium testing training in vadodara, selenium course in Vadodara","168","Selenium Training in Vadodara","29","Our Facts and Figures","21","Key Highlights","14","","","","https://www.tops-int.com/selenium-training-in-vadodara","","","","","","242434","24720","24720","9.627","","1623","430","3.774","68.989","Normal","6.871","2","0","","19","10","0","5.320","276","129","0","26","20","0","","","","","6746f5f864aac0b3d4a7cbe10bc86bcf","0.585","","","","","en","1.1","","https://www.tops-int.com/selenium-training-in-vadodara","2025-05-26 13:16:41"
"https://www.tops-int.com/blog/what-is-selenium","text/html; charset=UTF-8","200","OK","Indexable","","What is Selenium? Getting started Selenium Automation Testing","61","567","Explore Selenium, the powerful tool for Automation Testing. Get started with Selenium for efficient and reliable software testing in this comprehensive guide!","158","968","Selenium Automation Testing, Selenium Course,  Software Testing Course, Software Testing Course in Ahmedabad, Software Testing Course in Surat","142","What is Selenium? Getting started with Selenium Automation Testing","66","Languages and Browsers: What makes Selenium stand out is its adaptability:","74","Benefits of Selenium Automation Testing","39","","","","https://www.tops-int.com/blog/what-is-selenium","","","","","","200528","25795","25795","10.046","","2113","399","5.296","59.245","Fairly Hard","10.168","2","1","","12","10","0","5.320","315","184","0","10","6","0","","","","","4a3b263244b2d42344455948b712bde5","0.362","","","","","en","1.1","","https://www.tops-int.com/blog/what-is-selenium","2025-05-26 13:16:41"
"https://www.tops-int.com/selenium-training-in-rajkot","text/html; charset=UTF-8","200","OK","Indexable","","Selenium Training in Rajkot - TOPS Technologies","47","431","Selenium Training in Rajkot with 100% Job at 3000+ IT Cos - Learn Basic and Advanced software testing - with Interview questions - Certificate - ⭐TOPS Technologies","163","1023","Selenium Training in Rajkot, selenium web development in rajkot, selenium course in Rajkot, selenium training in Rajkot, selenium offline coaching in Rajkot, selenium testing training in Rajkot","193","Selenium Training in Rajkot","27","Our Facts and Figures","21","Key Highlights","14","","","","https://www.tops-int.com/selenium-training-in-rajkot","","","","","","242166","24617","24617","9.587","","1595","428","3.727","70.610","Fairly Easy","6.781","2","0","","19","10","0","5.320","276","129","0","25","19","0","","","","","879eb69d7926e37e852f525fafefbadf","0.652","","","","","en","1.1","","https://www.tops-int.com/selenium-training-in-rajkot","2025-05-26 13:16:41"
"https://www.tops-int.com/css/webinar.css","text/css","200","OK","Indexable","","","0","0","","0","0","","0","","0","","0","","0","","","","","","","","","","0","0","0","0.000","","0","","","","","0.000","2","1","","0","0","0","0.000","0","0","0","0","0","0","","","","","","0.097","Fri, 10 Mar 2023 11:49:28 GMT","","","","","1.1","","https://www.tops-int.com/css/webinar.css","2025-05-26 13:16:42"
"https://www.tops-int.com/webinar/careerinitwebinar31stmay/register","text/html; charset=UTF-8","200","OK","Non-Indexable","Canonicalised","Best IT Training &amp; Placement Company in India | Tops Technologies","69","598","","0","0","","0","","0","Register for the Webinar","24","","0","","","","https://www.tops-int.com/webinar/careerinitwebinar31stmay","","","","","","163120","16648","16648","6.483","","100","36","2.778","92.344","Very Easy","4.919","2","2","","4","2","0","1.060","248","124","0","6","6","0","","","","","1542e6be5672cf59bcfe3d0702d9dcf7","0.436","","","","","en","1.1","","https://www.tops-int.com/webinar/careerinitwebinar31stmay/register","2025-05-26 13:16:42"
